{
  "schemaVersion": "AcceptedExperimentRunBundle-v1",
  "publicationTier": "tracked_sanitized",
  "envelope": {
    "schemaVersion": "ExperimentRunEnvelope-v2",
    "experimentId": "EXP-030",
    "runId": "EXP-030-87dbd95035e4",
    "attemptId": "attempt-001",
    "executionStatus": "succeeded",
    "startedAt": "2026-07-26T00:00:00+03:00",
    "completedAt": "2026-07-26T00:00:00+03:00",
    "durationMilliseconds": null,
    "manifestSchema": "SanitizedAggregateSource",
    "manifestPath": "experiments/bigui-program-v1.json",
    "manifestSha256": "87dbd95035e4312bebaba32b51cd25939a9c29c0467bc46c7eee37f2bffc8371",
    "acceptanceStatus": "accepted",
    "acceptedAt": "2026-07-26T00:00:00+03:00",
    "evidenceClass": "offline",
    "sourceRevision": "ace3baaf1d49225e7b8f763cb896caefeb4d3117",
    "inputHashes": {
      "baselineCohort": "fdf816bcf5a814f73726dfe864f4ce55a76f531b15100c20f4944347b4692c7f"
    },
    "outputHashes": {
      "summary": "87dbd95035e4312bebaba32b51cd25939a9c29c0467bc46c7eee37f2bffc8371"
    },
    "metricObservationIds": [
      "OBS-METRIC-BIGUI_DEFINITION_FIELD_COMPLETENESS-5bbba755db7b",
      "OBS-METRIC-BIGUI_DEFINITION_ID_UNIQUENESS-22533dfdfd9c"
    ],
    "metricDefinitionHashes": {
      "BIGUI_DEFINITION_FIELD_COMPLETENESS": "c2462068ad4eee339c73ca62adc67faca3eb1d2ea2b00a7f32b25718ef1bed15",
      "BIGUI_DEFINITION_ID_UNIQUENESS": "f321c6a522c2a12ab70aacebb4ded48b0945888be9fd1524b708998fa61fc017"
    },
    "comparisonContext": {
      "datasetHash": "fdf816bcf5a814f73726dfe864f4ce55a76f531b15100c20f4944347b4692c7f",
      "partitionHash": "not_applicable",
      "baselineRevision": "2eeccb1cbb2d01faa3e8ceb43466a52e0fee23cf",
      "policyVersion": "m4b1-v1",
      "promptVersion": "historical-frozen",
      "modelIdentifier": "gpt-4o-historical-alias",
      "metricSchemaVersion": "2.0",
      "labelEligibility": "generalization_safe",
      "leakageClass": "none",
      "evidenceClass": "offline",
      "architectureMode": "legacy",
      "topology": "not_applicable",
      "interfaceVersion": "BigUI-v2",
      "pairedCohortHash": "fdf816bcf5a814f73726dfe864f4ce55a76f531b15100c20f4944347b4692c7f"
    },
    "artifactRefs": [
      "experiments/bigui-program-v1.json"
    ],
    "logRef": null,
    "evaluation": {
      "schemaVersion": "ExperimentEvaluation-v1",
      "experimentId": "EXP-030",
      "runId": "EXP-030-87dbd95035e4",
      "executionValid": true,
      "deterministic": true,
      "engineeringTargetMet": null,
      "evidenceAdmissible": true,
      "resultVerdict": "CONFORMANCE_PASS",
      "criteria": [
        {
          "id": "SOURCE_PRESENT_AND_HASHED",
          "passed": true,
          "detail": "The source summary exists and has a recorded SHA-256 hash."
        },
        {
          "id": "CLAIM_BOUNDARY_RECORDED",
          "passed": true,
          "detail": "The run records its admissible evidence boundary."
        }
      ],
      "claimBoundary": "BigUI extension-definition fidelity only; catalog, run, and browser fidelity remain separately checked."
    }
  },
  "metricDefinitions": [
    {
      "schemaVersion": "MetricDefinition-v1",
      "metricId": "BIGUI_DEFINITION_FIELD_COMPLETENESS",
      "title": "Extension definitions with complete required fields",
      "description": "Extension definitions with complete required fields",
      "formula": "7 / 7",
      "unit": "proportion",
      "direction": "target",
      "grain": "experiment run",
      "requiredEvidenceClass": "offline",
      "nullable": false,
      "nullRule": "Observed from the accepted experiment run.",
      "dimensions": [],
      "target": {
        "operator": "eq",
        "value": 1
      }
    },
    {
      "schemaVersion": "MetricDefinition-v1",
      "metricId": "BIGUI_DEFINITION_ID_UNIQUENESS",
      "title": "Unique extension experiment IDs",
      "description": "Unique extension experiment IDs",
      "formula": "7 / 7",
      "unit": "proportion",
      "direction": "target",
      "grain": "experiment run",
      "requiredEvidenceClass": "offline",
      "nullable": false,
      "nullRule": "Observed from the accepted experiment run.",
      "dimensions": [],
      "target": {
        "operator": "eq",
        "value": 1
      }
    }
  ],
  "metricObservations": [
    {
      "schemaVersion": "MetricObservation-v2",
      "observationId": "OBS-METRIC-BIGUI_DEFINITION_FIELD_COMPLETENESS-5bbba755db7b",
      "experimentId": "EXP-030",
      "runId": "EXP-030-87dbd95035e4",
      "metricId": "BIGUI_DEFINITION_FIELD_COMPLETENESS",
      "metricDefinitionSha256": "c2462068ad4eee339c73ca62adc67faca3eb1d2ea2b00a7f32b25718ef1bed15",
      "baselineId": "bigui-program-contract",
      "comparatorId": "validated-extension-definitions",
      "value": 1.0,
      "numerator": 7,
      "denominator": 7,
      "missingCount": 0,
      "unit": "proportion",
      "direction": "target",
      "estimand": "Extension definitions with complete required fields",
      "grain": "experiment run",
      "dimensions": {},
      "exclusions": [],
      "analysisMethod": "deterministic aggregate",
      "confidenceInterval": null,
      "sourcePath": "experiments/bigui-program-v1.json",
      "sourceSha256": "87dbd95035e4312bebaba32b51cd25939a9c29c0467bc46c7eee37f2bffc8371",
      "evidenceClass": "offline",
      "observationDate": "2026-07-26",
      "cohortHash": "fdf816bcf5a814f73726dfe864f4ce55a76f531b15100c20f4944347b4692c7f",
      "metricSchemaVersion": "2.0",
      "claimBoundary": "Tracked BigUI extension-definition fidelity only. Full catalog, run, and browser fidelity are enforced separately; no classification validity follows."
    },
    {
      "schemaVersion": "MetricObservation-v2",
      "observationId": "OBS-METRIC-BIGUI_DEFINITION_ID_UNIQUENESS-22533dfdfd9c",
      "experimentId": "EXP-030",
      "runId": "EXP-030-87dbd95035e4",
      "metricId": "BIGUI_DEFINITION_ID_UNIQUENESS",
      "metricDefinitionSha256": "f321c6a522c2a12ab70aacebb4ded48b0945888be9fd1524b708998fa61fc017",
      "baselineId": "bigui-program-contract",
      "comparatorId": "validated-extension-definitions",
      "value": 1.0,
      "numerator": 7,
      "denominator": 7,
      "missingCount": 0,
      "unit": "proportion",
      "direction": "target",
      "estimand": "Unique extension experiment IDs",
      "grain": "experiment run",
      "dimensions": {},
      "exclusions": [],
      "analysisMethod": "deterministic aggregate",
      "confidenceInterval": null,
      "sourcePath": "experiments/bigui-program-v1.json",
      "sourceSha256": "87dbd95035e4312bebaba32b51cd25939a9c29c0467bc46c7eee37f2bffc8371",
      "evidenceClass": "offline",
      "observationDate": "2026-07-26",
      "cohortHash": "fdf816bcf5a814f73726dfe864f4ce55a76f531b15100c20f4944347b4692c7f",
      "metricSchemaVersion": "2.0",
      "claimBoundary": "Tracked BigUI extension-definition fidelity only. Full catalog, run, and browser fidelity are enforced separately; no classification validity follows."
    }
  ],
  "acceptance": {
    "schemaVersion": "RunAcceptanceRecord-v1",
    "experimentId": "EXP-030",
    "runId": "EXP-030-87dbd95035e4",
    "status": "accepted",
    "evaluatorVersion": "bigui-run-store-v1",
    "evaluatedAt": "2026-07-26T00:00:00+03:00",
    "criteriaOutcomes": [
      {
        "id": "SOURCE_PRESENT_AND_HASHED",
        "passed": true,
        "detail": "The source summary exists and has a recorded SHA-256 hash."
      },
      {
        "id": "CLAIM_BOUNDARY_RECORDED",
        "passed": true,
        "detail": "The run records its admissible evidence boundary."
      }
    ],
    "rationale": "The privacy-safe aggregate run is accepted for its stated evidence class.",
    "approverClass": "deterministic_validator"
  }
}
